{
    "$schema": "http://json-schema.org/draft-07/schema#",
    "$id": "https://standards.namm.org/schema/2020.1/po_status.json",
    "type": "object",
    "title": "NAMM_PO_Status",
    "additionalProperties": false,
    "properties": {
        "Version": {
            "$ref": "https://standards.namm.org/schema/2020.1/common.json#/definitions/Version"
        },
        "Id": {
            "type": "string",
            "description": "Document ID",
            "maxLength": 50
        },
        "Timestamp": {
            "type": "string",
            "format": "date-time"
        },
        "POStatusRequestId": {
            "type": "string",
            "description": "PO ID of status request",
            "maxLength": 50
        },
        "BuyerOrderId": {
            "type": "string",
            "description": "Buyer order ID",
            "maxLength": 25
        },
        "DateOrdered": {
            "type": "string",
            "description": "Order Date",
            "format": "date"
        },
        "BuyerName": {
            "type": "string",
            "description": "Buyer Name"
        },
        "Supplier": {
            "$ref": "https://standards.namm.org/schema/2020.1/common.json#/definitions/Party"
        },
        "SoldTo": {
            "$ref": "https://standards.namm.org/schema/2020.1/common.json#/definitions/Party"
        },
        "StatusCode": {
            "$ref": "#/definitions/StatusCode"
        },
        "PaymentTerms": {
            "type": "object",
            "additionalProperties": false,
            "properties": {
                "StatusCode": {
                    "type": "string",
                    "description": "Payment status code"
                },
                "StatusMessage": {
                    "type": "string"
                },
                "TermsCode": {
                    "$ref": "https://standards.namm.org/schema/2020.1/common.json#/definitions/TermsCode"
                }
            },
            "required": [
                "StatusCode",
                "StatusMessage",
                "TermsCode"
            ]
        },
        "ShipmentTerms": {
            "type": "object",
            "additionalProperties": {
                "not": {}
            },
            "properties": {
                "StatusCode": {
                    "type": "string",
                    "description": "Shipment status code"
                }
            }
        },
        "ShipTo": {
            "$ref": "https://standards.namm.org/schema/2020.1/common.json#/definitions/Party"
        },
        "Items": {
            "type": "array",
            "items": {
                "type": "object",
                "additionalProperties": false,
                "properties": {
                    "POLineNbr": {
                        "type": "integer",
                        "description": "Item line number"
                    },
                    "SequenceNbr": {
                        "type": "integer",
                        "description": "Item sequence number"
                    },
                    "StatusCode": {
                        "$ref": "#/definitions/StatusCode"
                    },
                    "StatusMessage": {
                        "type": "string",
                        "description": "Item Status Message"
                    },
                    "Qty": {
                        "type": "number",
                        "description": "Item Quantity"
                    },
                    "OriginalOrderQty": {
                        "type": "number",
                        "description": "Original order quantity"
                    },
                    "QtyUOM": {
                        "$ref": "https://standards.namm.org/schema/2020.1/common.json#/definitions/QtyUOM"
                    },
                    "UCValue": {
                        "type": "number",
                        "description": "Unit cost"
                    },
                    "OriginalOrderUCValue": {
                        "type": "number",
                        "description": "Original Unit Cost"
                    },
                    "UCCurrencyCode": {
                        "$ref": "https://standards.namm.org/schema/2020.1/common.json#/definitions/CurrencyCode"
                    },
                    "EstimatedShipDate": {
                        "type": "string",
                        "description": "Estimated Shipping Date",
                        "format": "date"
                    },
                    "SupplierOrderId": {
                        "type": "string",
                        "description": "Suppliers Order ID"
                    },
                    "BuyerItemId": {
                        "type": "string",
                        "description": "Buyer Item ID"
                    },
                    "SupplierItemId": {
                        "type": "string",
                        "description": "Supplier Item ID"
                    },
                    "BarCodeId": {
                        "type": "string",
                        "description": "Barcode Value"
                    },
                    "BarCodeType": {
                        "$ref": "https://standards.namm.org/schema/2020.1/common.json#/definitions/BarCodeType"
                    },
                    "ShipTo": {
                        "oneOf": [
                            {
                                "$ref": "https://standards.namm.org/schema/2020.1/common.json#/definitions/Party"
                            },
                            {
                                "type": "object",
                                "properties": {
                                    "Name": {
                                        "type": "string",
                                        "maxLength": 35
                                    },
                                    "Address": {
                                        "#ref": "https://standards.namm.org/schema/common.json#Address"
                                    }
                                },
                                "required": [
                                    "Address",
                                    "Name"
                                ]
                            }
                        ]
                    }
                }
            }
        }
    },
    "required": [],
    "definitions": {
        "StatusCode": {
            "type": "string",
            "description": "Status Codes for Document and Item (TBD)",
            "enum": [
                "1",
                "2",
                "3",
                "Changes",
                "C1"
            ]
        }
    }
}